### ISSUE TITLE
Клиент подключается без доступа к интернету

### ISSUE THREAD

**Issue by SanchezZz-z** [anton48/vk-turn-proxy-ios#16]
Привет

Спасибо за Ваш клиент для iOS, правда никак не получается его завести:(

Использую абсолютно одинаковый конфиг в двух разных клиентах для iOS: в Вашем и в [turnbridge](https://github.com/iamdiviem/turnbridge) (форке [этого](https://github.com/nullcstring/turnbridge) репозитория).
Проблема в том, что последний работает, хоть и с чудовищно медленной скоростью, а Ваш подключить все никак не могу.

Пробовал использовать разные серверы: [Ваш](https://github.com/anton48/vk-turn-proxy) и [оригинальный](https://github.com/cacggghp/vk-turn-proxy) -- результат одинаковый.

Когда смотрю tcpdump с Вашим клиентом, то вижу следующее:

20:03:44.291979 lo    In  IP 127.0.0.1.40478 > 127.0.0.1.14007: UDP, length 1280
20:03:44.292270 lo    In  IP 127.0.0.1.52734 > 127.0.0.1.14007: UDP, length 1280
20:03:44.294601 lo    In  IP 127.0.0.1.46563 > 127.0.0.1.14007: UDP, length 1280

А с клиентом от iamdiviem:

20:09:24.863565 lo    In  IP 127.0.0.1.54361 > 127.0.0.1.14007: UDP, length 148
20:09:24.866285 lo    In  IP 127.0.0.1.14007 > 127.0.0.1.54361: UDP, length 92
20:09:25.005566 lo    In  IP 127.0.0.1.54361 > 127.0.0.1.14007: UDP, length 32
20:09:25.014392 lo    In  IP 127.0.0.1.54361 > 127.0.0.1.14007: UDP, length 112
20:09:25.016307 lo    In  IP 127.0.0.1.54361 > 127.0.0.1.14007: UDP, length 96
20:09:25.016391 lo    In  IP 127.0.0.1.54361 > 127.0.0.1.14007: UDP, length 112
20:09:25.019381 lo    In  IP 127.0.0.1.14007 > 127.0.0.1.54361: UDP, length 320
20:09:25.020265 lo    In  IP 127.0.0.1.14007 > 127.0.0.1.54361: UDP, length 416
20:09:25.021988 lo    In  IP 127.0.0.1.14007 > 127.0.0.1.54361: UDP, length 320

То есть, при подключении через Вашего клиента пакеты идут только в одну сторону, поэтому, как я понимаю, доступа к интернету и нет.
Может ли быть разница в том, что конфиг в клиенте iamdiviem явно требуется указать адрес [listen](https://github.com/iamdiviem/turnbridge/blob/254d7e23f48e72a4509ce4f08cf07b8c54064c13/quick_link.py#L8) и [Endpoint](https://github.com/iamdiviem/turnbridge/blob/254d7e23f48e72a4509ce4f08cf07b8c54064c13/quick_link.py#L19), а в Вашем клиенте таких параметров нет? Просто у меня они настроены не на 9000 порт.

Логи на клиенте не показывают ничего дальше строчки:

[2026-05-24 20:45:12.716] [Tunnel] vk: success via VK Calls captcha-free path

Ну и еще я пытался запустить Ваш сервер с SRTP и подключиться клиентом со включенной SRTP маскировкой (так как прочитал, что именно так можно добиться максимальной скорости), но получил ошибку:

2026/05/24 20:42:05 Connection from 90.156.236.66:54567
2026/05/24 20:42:05 Start handshake
2026/05/24 20:42:05 handshake error: dtls fatal: client requested SRTP but we have no matching profiles

Сервер запускаю командой ./server -listen 0.0.0.0:56004 -connect 127.0.0.1:14007 -srtp (порт в peerAddress клиента при этом меняю с 56000 на 56004, "Use SRTP" включаю). Но, очевидно, нет никакого смысла переходить к этой проблеме, не решив первую.

**Comment by aloki** [comment]
> Сервер запускаю командой ./server -listen 0.0.0.0:56004 -connect 127.0.0.1:14007 srtp

Это ошибка копипаста или реальная команда? Потому что должно быть `-srtp`.

**Comment by anton48** [comment]
> Когда смотрю tcpdump с Вашим клиентом, то вижу следующее:
> 
> 20:03:44.291979 lo In IP 127.0.0.1.40478 > 127.0.0.1.14007: UDP, length 1280 20:03:44.292270 lo In IP 127.0.0.1.52734 > 127.0.0.1.14007: UDP, length 1280 20:03:44.294601 lo In IP 127.0.0.1.46563 > 127.0.0.1.14007: UDP, length 1280

а где вы снимаете этот tcpdump? и что работает на 127.0.0.1.14007 - wireguard сервер на vps? 

если да (судя по ./server -listen 0.0.0.0:56004 -connect 127.0.0.1:14007 это именно так), то wireguard по какой-то причине не отвечает.

**Comment by SanchezZz-z** [comment]
> Это ошибка копипаста или реальная команда? Потому что должно быть `-srtp`.

Да, тут я тупанул и не с той ветки собрал server... Сейчас собрал с нужной и запустил правильно (-srtp) и хендшейки пошли. Спасибо.

> а где вы снимаете этот tcpdump?

tcpdump я снимал на VPS, на loopback-интерфейсе (sudo tcpdump -ni lo udp port 14007).  То есть это трафик между TURN-proxy и wireguard/Xray.

На порту 14007 работает wireguard inbound в 3X-UI/Xray. В конфигурации wireguard указан Endpoint = <ip_vps>:14007 для внешних клиентов.

**Comment by anton48** [comment]
насколько я понимаю, как устроен fork iamdiviem, там встроенный клиент wireguard идет на 127.0.0.1:9000 думая, что это его peer (это "endpoint"), там его пакеты перехватывают (это "listen") и отправляют TURN серверу (ну и делают обратное с пакетами приходящими от TURN). 

у меня такого нет, передача пакетов происходит без сокета (на 127.0.0.1:9000 или еще где). 

в моей семантике peer - это адрес/порт на котором слушает сервер (оригинальный https://github.com/cacggghp/vk-turn-proxy или мой, это без разницы). 

а как выглядит tcpdump не на loopback, а на реальном интерфейсе, который слушает в интернет? кроме прочего, меня смущает, что с моим клиентом идут строго пакеты длиной 1280, а у iamdiviem разной.

**Comment by anton48** [comment]
> На порту 14007 работает wireguard inbound в 3X-UI/Xray. В конфигурации wireguard указан Endpoint = <ip_vps>:14007 для внешних клиентов.

если в конфигурации wg указан внешний адрес (ip_vps), то он не будет отвечать на пакеты от прокси, которые идут на 127.0.0.1:14007

**Comment by SanchezZz-z** [comment]
Честно говоря, я совсем запутался и не особо представляю, в какую сторону копать, так что просто пошагово распишу свои действия.

1. Собрал [Ваш](https://github.com/anton48/vk-turn-proxy) сервер и запускаю его:

```
./server -listen 0.0.0.0:56000 -connect 127.0.0.1:14007
2026/05/25 17:05:08 Listening (DTLS mode) on 0.0.0.0:56000
```

2. Пересоздал в 3X-UI WG inbound со следующим конфигом:

```
{
  "listen": "127.0.0.1",
  "port": 14007,
  "protocol": "wireguard",
  "settings": {
    "mtu": 1280,
    "secretKey": "YYY",
    "peers": [
      {
        "privateKey": "XXX",
        "publicKey": "lAIt39iFL9BWaQA+0RggFk3kVd7lVwuPpIUQP3ntezc=",
        "allowedIPs": [
          "10.0.0.2/32"
        ],
        "keepAlive": 25
      }
    ],
    "noKernelTun": false
  },
  "sniffing": {
    "enabled": false
  },
  "tag": "inbound-127.0.0.1:14007"
}
```

3. Конфиг для форка iamdiviem из скрипта [quick_link.py](https://github.com/iamdiviem/turnbridge/blob/main/quick_link.py):

```
config = {
    "name": "vk test NL",
    "turn": "https://vk.com/call/join/VVV",
    "peer": "<ip_vps>:56000",
    "listen": "127.0.0.1:14007",
    "n": 10,
    "wg": """[Interface]
PrivateKey = XXX
Address = 10.0.0.2/32
DNS = 1.1.1.1, 1.0.0.1
MTU = 1280

[Peer]
PublicKey = Hve0UnDy3GRjBTsdGndLu+jY29mJZtyWcBD398QyBWI=
AllowedIPs = 0.0.0.0/0, ::/0
Endpoint = 127.0.0.1:14007"""
}
```

4. Конфиг для Вашего клиента из сегодняшней версии [quick_link.py](https://github.com/anton48/vk-turn-proxy-ios/blob/main/quick_link.py):

```
CONFIG = {
    # ----- required -----
    "privateKey":     "XXX",
    "peerPublicKey":  "Hve0UnDy3GRjBTsdGndLu+jY29mJZtyWcBD398QyBWI=",
    "tunnelAddress":  "10.0.0.2/32",
    "allowedIPs":     "0.0.0.0/0",
    "vkLink":         "https://vk.com/call/join/VVV",         # https://vk.me/join/...
    "peerAddress":    "<ip_vps>:56000",         # ip:port of the WG server
    "dnsServers":     "1.1.1.1",
    "numConnections": 30,
    "useDTLS":        True,                 # default; legacy DTLS+WG fallback
    "useWrap":        False,                # WRAP largely defunct since 2026-05-18
    "wrapKeyHex":     "",                   # 64 hex chars, only if useWrap=True
    "useSrtp":        False,
    "useUDP":         False,
}
```

> а как выглядит tcpdump не на loopback, а на реальном интерфейсе, который слушает в интернет?

Вот пример tcpdump (`sudo tcpdump -ni ens3 udp port 56000`) при попытке подключения с клиента iamdiviem:

```
17:22:09.623922 IP 90.156.236.66.52207 > <ip_vps>.56000: UDP, length 121
17:22:09.623923 IP 90.156.236.66.52207 > <ip_vps>.56000: UDP, length 121
17:22:09.624841 IP 90.156.236.66.52207 > <ip_vps>.56000: UDP, length 121
17:22:09.624923 IP <ip_vps>.56000 > 90.156.236.66.52207: UDP, length 48
17:22:09.624941 IP 90.156.236.66.52207 > <ip_vps>.56000: UDP, length 121
17:22:09.684702 IP 90.156.236.66.52207 > <ip_vps>.56000: UDP, length 141
17:22:09.687435 IP <ip_vps>.56000 > 90.156.236.66.52207: UDP, length 724
17:22:09.755083 IP 90.156.236.66.52207 > <ip_vps>.56000: UDP, length 142
17:22:09.755966 IP <ip_vps>.56000 > 90.156.236.66.52207: UDP, length 75
17:22:11.054143 IP 90.156.236.66.52207 > <ip_vps>.56000: UDP, length 194
17:22:11.057179 IP <ip_vps>.56000 > 90.156.236.66.52207: UDP, length 129
17:22:11.129626 IP 90.156.236.66.52207 > <ip_vps>.56000: UDP, length 158
17:22:11.129626 IP 90.156.236.66.52207 > <ip_vps>.56000: UDP, length 142
17:22:11.129627 IP 90.156.236.66.52207 > <ip_vps>.56000: UDP, length 142
17:22:11.129627 IP 90.156.236.66.52207 > <ip_vps>.56000: UDP, length 142
17:22:11.129627 IP 90.156.236.66.52207 > <ip_vps>.56000: UDP, length 142
17:22:11.142831 IP <ip_vps>.56000 > 90.156.236.66.52207: UDP, length 453
17:22:11.143223 IP <ip_vps>.56000 > 90.156.236.66.52207: UDP, length 453
17:22:11.143286 IP <ip_vps>.56000 > 90.156.236.66.52207: UDP, length 213
17:22:11.143558 IP <ip_vps>.56000 > 90.156.236.66.52207: UDP, length 197
17:22:11.143604 IP <ip_vps>.56000 > 90.156.236.66.52207: UDP, length 213
17:22:11.250671 IP 90.156.236.66.52207 > <ip_vps>.56000: UDP, length 142
17:22:11.251597 IP 90.156.236.66.52207 > <ip_vps>.56000: UDP, length 142
17:22:11.251597 IP 90.156.236.66.52207 > <ip_vps>.56000: UDP, length 142
17:22:11.255950 IP <ip_vps>.56000 > 90.156.236.66.52207: UDP, length 213
17:22:11.256837 IP <ip_vps>.56000 > 90.156.236.66.52207: UDP, length 197
17:22:11.261144 IP <ip_vps>.56000 > 90.156.236.66.52207: UDP, length 165
17:22:11.319161 IP 90.156.236.66.52207 > <ip_vps>.56000: UDP, length 1310
17:22:11.320475 IP 90.156.236.66.52207 > <ip_vps>.56000: UDP, length 142
17:22:11.320475 IP 90.156.236.66.52207 > <ip_vps>.56000: UDP, length 142
17:22:11.321401 IP 90.156.236.66.52207 > <ip_vps>.56000: UDP, length 142
17:22:11.328394 IP <ip_vps>.56000 > 90.156.236.66.52207: UDP, length 133
17:22:11.328860 IP <ip_vps>.56000 > 90.156.236.66.52207: UDP, length 133
17:22:11.329064 IP <ip_vps>.56000 > 90.156.236.66.52207: UDP, length 133
17:22:11.342725 IP 90.156.236.66.52207 > <ip_vps>.56000: UDP, length 142
17:22:11.342725 IP 90.156.236.66.52207 > <ip_vps>.56000: UDP, length 142
17:22:11.344648 IP <ip_vps>.56000 > 90.156.236.66.52207: UDP, length 133
17:22:11.344914 IP <ip_vps>.56000 > 90.156.236.66.52207: UDP, length 133
17:22:11.398731 IP 90.156.236.66.52207 > <ip_vps>.56000: UDP, length 142
17:22:11.398731 IP 90.156.236.66.52207 > <ip_vps>.56000: UDP, length 654
17:22:11.398731 IP 90.156.236.66.52207 > <ip_vps>.56000: UDP, length 142
17:22:11.398731 IP 90.156.236.66.52207 > <ip_vps>.56000: UDP, length 654
17:22:11.398731 IP 90.156.236.66.52207 > <ip_vps>.56000: UDP, length 142
17:22:11.398731 IP 90.156.236.66.52207 > <ip_vps>.56000: UDP, length 654
17:22:11.403920 IP <ip_vps>.56000 > 90.156.236.66.52207: UDP, length 133
17:22:11.404265 IP <ip_vps>.56000 > 90.156.236.66.52207: UDP, length 133
17:22:11.404627 IP <ip_vps>.56000 > 90.156.236.66.52207: UDP, length 133
17:22:11.410538 IP <ip_vps>.56000 > 90.156.236.66.52207: UDP, length 1333
17:22:11.410766 IP <ip_vps>.56000 > 90.156.236.66.52207: UDP, length 1333
```

Логи сервера при этом:

```
2026/05/25 17:22:09 Connection from 90.156.236.66:52207
2026/05/25 17:22:09 Start handshake
2026/05/25 17:22:09 Handshake done
```

tcpdump при подключении Вашим клиентом:

```
17:28:59.003836 IP 90.156.236.66.34489 > <ip_vps>.56000: UDP, length 122
17:28:59.004744 IP <ip_vps>.56000 > 90.156.236.66.34489: UDP, length 48
17:28:59.065650 IP 90.156.236.66.34489 > <ip_vps>.56000: UDP, length 142
17:28:59.066682 IP <ip_vps>.56000 > 90.156.236.66.34489: UDP, length 712
17:28:59.128327 IP 90.156.236.66.34489 > <ip_vps>.56000: UDP, length 133
17:28:59.129416 IP <ip_vps>.56000 > 90.156.236.66.34489: UDP, length 75
17:28:59.189302 IP 90.156.236.66.34489 > <ip_vps>.56000: UDP, length 1317
17:28:59.190094 IP <ip_vps>.56000 > 90.156.236.66.34489: UDP, length 1317
17:28:59.239641 IP 90.156.236.66.34489 > <ip_vps>.56000: UDP, length 1317
17:28:59.240244 IP <ip_vps>.56000 > 90.156.236.66.34489: UDP, length 1317
17:28:59.291013 IP 90.156.236.66.34489 > <ip_vps>.56000: UDP, length 1317
17:28:59.291841 IP <ip_vps>.56000 > 90.156.236.66.34489: UDP, length 1317
17:28:59.342255 IP 90.156.236.66.34489 > <ip_vps>.56000: UDP, length 1317
17:28:59.342914 IP <ip_vps>.56000 > 90.156.236.66.34489: UDP, length 1317
17:28:59.391602 IP 90.156.236.66.34489 > <ip_vps>.56000: UDP, length 1317
17:28:59.392172 IP <ip_vps>.56000 > 90.156.236.66.34489: UDP, length 1317
17:28:59.444359 IP 90.156.236.66.34489 > <ip_vps>.56000: UDP, length 1317
17:28:59.445173 IP <ip_vps>.56000 > 90.156.236.66.34489: UDP, length 1317
17:28:59.476111 IP 90.156.236.66.59614 > <ip_vps>.56000: UDP, length 122
17:28:59.477588 IP <ip_vps>.56000 > 90.156.236.66.59614: UDP, length 48
17:28:59.496036 IP 90.156.236.66.34489 > <ip_vps>.56000: UDP, length 1317
17:28:59.496795 IP <ip_vps>.56000 > 90.156.236.66.34489: UDP, length 1317
17:28:59.539738 IP 90.156.236.66.59614 > <ip_vps>.56000: UDP, length 142
17:28:59.541082 IP <ip_vps>.56000 > 90.156.236.66.59614: UDP, length 713
17:28:59.658599 IP 90.156.236.66.59614 > <ip_vps>.56000: UDP, length 133
17:28:59.659724 IP <ip_vps>.56000 > 90.156.236.66.59614: UDP, length 75
17:28:59.758284 IP 90.156.236.66.59614 > <ip_vps>.56000: UDP, length 1317
17:28:59.758854 IP <ip_vps>.56000 > 90.156.236.66.59614: UDP, length 1317
17:28:59.760749 IP 90.156.236.66.58898 > <ip_vps>.56000: UDP, length 122
17:28:59.762142 IP <ip_vps>.56000 > 90.156.236.66.58898: UDP, length 48
17:28:59.785077 IP 90.156.236.66.59614 > <ip_vps>.56000: UDP, length 1317
17:28:59.785835 IP <ip_vps>.56000 > 90.156.236.66.59614: UDP, length 1317
17:28:59.825528 IP 90.156.236.66.58898 > <ip_vps>.56000: UDP, length 142
17:28:59.826973 IP <ip_vps>.56000 > 90.156.236.66.58898: UDP, length 713
17:28:59.836080 IP 90.156.236.66.59614 > <ip_vps>.56000: UDP, length 1317
17:28:59.836540 IP <ip_vps>.56000 > 90.156.236.66.59614: UDP, length 1317
```

Логи сервера:

```
2026/05/25 17:28:59 Connection from 90.156.236.66:34489
2026/05/25 17:28:59 Start handshake
2026/05/25 17:28:59 Handshake done
2026/05/25 17:28:59 Connection from 90.156.236.66:59614
2026/05/25 17:28:59 Start handshake
2026/05/25 17:28:59 Handshake done
2026/05/25 17:28:59 Connection from 90.156.236.66:58898
2026/05/25 17:28:59 Start handshake
2026/05/25 17:28:59 Connection from 90.156.236.66:34269
2026/05/25 17:28:59 Start handshake
2026/05/25 17:28:59 Handshake done
2026/05/25 17:28:59 Handshake done
2026/05/25 17:29:00 Connection from 90.156.236.66:37561
2026/05/25 17:29:00 Start handshake
2026/05/25 17:29:00 Handshake done
2026/05/25 17:29:00 Connection from 90.156.236.66:43834
2026/05/25 17:29:00 Start handshake
2026/05/25 17:29:00 Handshake done
2026/05/25 17:29:00 Connection from 90.156.236.66:63842
2026/05/25 17:29:00 Start handshake
2026/05/25 17:29:00 Handshake done
2026/05/25 17:29:00 Connection from 90.156.236.66:41770
2026/05/25 17:29:00 Start handshake
2026/05/25 17:29:00 Handshake done
2026/05/25 17:29:00 Connection from 90.156.236.66:60873
2026/05/25 17:29:00 Start handshake
```

Попробовал при текущих настройках посмотреть на трафик между TURN и Wireguard (`sudo tcpdump -ni lo udp port 14007`) и для клента iamdiviem были пакеты:

```
17:37:53.035408 IP 127.0.0.1.47701 > 127.0.0.1.14007: UDP, length 148
17:37:53.037122 IP 127.0.0.1.14007 > 127.0.0.1.47701: UDP, length 92
17:37:53.154843 IP 127.0.0.1.47701 > 127.0.0.1.14007: UDP, length 112
17:37:53.161277 IP 127.0.0.1.14007 > 127.0.0.1.47701: UDP, length 320
17:37:53.170191 IP 127.0.0.1.47701 > 127.0.0.1.14007: UDP, length 96
17:37:53.174578 IP 127.0.0.1.14007 > 127.0.0.1.47701: UDP, length 416
17:37:53.179979 IP 127.0.0.1.47701 > 127.0.0.1.14007: UDP, length 112
17:37:53.189122 IP 127.0.0.1.14007 > 127.0.0.1.47701: UDP, length 320
17:37:53.310919 IP 127.0.0.1.47701 > 127.0.0.1.14007: UDP, length 96
17:37:53.311018 IP 127.0.0.1.47701 > 127.0.0.1.14007: UDP, length 96
17:37:53.311035 IP 127.0.0.1.47701 > 127.0.0.1.14007: UDP, length 96
17:37:53.315167 IP 127.0.0.1.14007 > 127.0.0.1.47701: UDP, length 96
17:37:53.319126 IP 127.0.0.1.14007 > 127.0.0.1.47701: UDP, length 176
17:37:53.319786 IP 127.0.0.1.14007 > 127.0.0.1.47701: UDP, length 128
17:37:53.410879 IP 127.0.0.1.47701 > 127.0.0.1.14007: UDP, length 96
17:37:53.419254 IP 127.0.0.1.47701 > 127.0.0.1.14007: UDP, length 608
17:37:53.419958 IP 127.0.0.1.14007 > 127.0.0.1.47701: UDP, length 96
17:37:53.420626 IP 127.0.0.1.47701 > 127.0.0.1.14007: UDP, length 96
17:37:53.421277 IP 127.0.0.1.14007 > 127.0.0.1.47701: UDP, length 96
17:37:53.426358 IP 127.0.0.1.47701 > 127.0.0.1.14007: UDP, length 96
17:37:53.426845 IP 127.0.0.1.14007 > 127.0.0.1.47701: UDP, length 96
17:37:53.478187 IP 127.0.0.1.14007 > 127.0.0.1.47701: UDP, length 1296
17:37:53.478643 IP 127.0.0.1.14007 > 127.0.0.1.47701: UDP, length 1296
17:37:53.478843 IP 127.0.0.1.14007 > 127.0.0.1.47701: UDP, length 1280
```

А с Вашим клиентом тишина:(

То есть, как будто в обоих случаях трафик доходит до TURN сервера на VPS, но почему-то при подключении через Ваш клиент не доходит до инбаунда Wireguard.

**Comment by anton48** [comment]
По настройкам у вас на мой взгляд все выглядит корректно. 

А как долго вы ждали результатов tcpdump на loopback? Дело в том, что в режиме DTLS при старте мой клиент делает измерения скорости и этот трафик еще не доходит до WireGuard. 

В логе это выглядит так:

Соединения установлены:

MacBook-Air-M4:25.05.2026 a48$ grep DTLS vpn.wifi.dtls.2.log
[Go] 18:48:21.188263 proxy: [conn 0, cred 0] DTLS+TURN session established
[Go] 18:48:21.456457 proxy: [conn 1, cred 0] DTLS+TURN session established
[Go] 18:48:21.655589 proxy: [conn 2, cred 0] DTLS+TURN session established
[Go] 18:48:21.859052 proxy: [conn 3, cred 0] DTLS+TURN session established
[Go] 18:48:22.053556 proxy: [conn 4, cred 0] DTLS+TURN session established
[Go] 18:48:22.256618 proxy: [conn 5, cred 0] DTLS+TURN session established
[Go] 18:48:22.456020 proxy: [conn 6, cred 0] DTLS+TURN session established
[Go] 18:48:22.656183 proxy: [conn 7, cred 0] DTLS+TURN session established
[Go] 18:48:22.853377 proxy: [conn 8, cred 0] DTLS+TURN session established
[Go] 18:48:23.053739 proxy: [conn 9, cred 0] DTLS+TURN session established

Через примерно 35 секунд в логе появляются результаты измерения:

MacBook-Air-M4:25.05.2026 a48$ grep "shape probe" vpn.wifi.dtls.2.log
[Go] 18:48:56.188424 proxy: [conn 0] shape probe: SHAPED (got 216/600 pongs in 35s = 7.7 KB/s, threshold 12 KB/s) — diagnostic only, killer disabled, conn kept
[Go] 18:48:56.456851 proxy: [conn 1] shape probe: SHAPED (got 219/600 pongs in 35s = 7.8 KB/s, threshold 12 KB/s) — diagnostic only, killer disabled, conn kept
[Go] 18:48:56.655674 proxy: [conn 2] shape probe: SHAPED (got 219/600 pongs in 35s = 7.8 KB/s, threshold 12 KB/s) — diagnostic only, killer disabled, conn kept
[Go] 18:48:56.859220 proxy: [conn 3] shape probe: SHAPED (got 216/600 pongs in 35s = 7.7 KB/s, threshold 12 KB/s) — diagnostic only, killer disabled, conn kept
[Go] 18:48:57.054337 proxy: [conn 4] shape probe: SHAPED (got 216/600 pongs in 35s = 7.7 KB/s, threshold 12 KB/s) — diagnostic only, killer disabled, conn kept
[Go] 18:48:57.256420 proxy: [conn 5] shape probe: SHAPED (got 215/600 pongs in 35s = 7.7 KB/s, threshold 12 KB/s) — diagnostic only, killer disabled, conn kept
[Go] 18:48:57.455697 proxy: [conn 6] shape probe: SHAPED (got 219/600 pongs in 35s = 7.8 KB/s, threshold 12 KB/s) — diagnostic only, killer disabled, conn kept
[Go] 18:48:57.656837 proxy: [conn 7] shape probe: SHAPED (got 219/600 pongs in 35s = 7.8 KB/s, threshold 12 KB/s) — diagnostic only, killer disabled, conn kept
[Go] 18:48:57.853650 proxy: [conn 8] shape probe: SHAPED (got 216/600 pongs in 35s = 7.7 KB/s, threshold 12 KB/s) — diagnostic only, killer disabled, conn kept
[Go] 18:48:58.053397 proxy: [conn 9] shape probe: SHAPED (got 216/600 pongs in 35s = 7.7 KB/s, threshold 12 KB/s) — diagnostic only, killer disabled, conn kept

Только после этого начинает идти реальный трафик в сторону WireGuard сервера. 

На уровне tcpdump это выглядит так: 

на интерфейсе, который смотрит в интернет, то есть там, где пакеты между VK TURN и нашим proxy сервером:

18:48:21.243692 IP 90.156.234.245.64647 > XXX.XXX.XXX.XXX.56000: UDP, length 122
18:48:21.244103 IP XXX.XXX.XXX.XXX.56000 > 90.156.234.245.64647: UDP, length 48
18:48:21.253028 IP 90.156.234.245.64647 > XXX.XXX.XXX.XXX.56000: UDP, length 142
18:48:21.253235 IP XXX.XXX.XXX.XXX.56000 > 90.156.234.245.64647: UDP, length 710
18:48:21.265340 IP 90.156.234.245.64647 > XXX.XXX.XXX.XXX.56000: UDP, length 133
18:48:21.265544 IP XXX.XXX.XXX.XXX.56000 > 90.156.234.245.64647: UDP, length 75
18:48:21.276058 IP 90.156.234.245.64647 > XXX.XXX.XXX.XXX.56000: UDP, length 1317
18:48:21.276118 IP XXX.XXX.XXX.XXX.56000 > 90.156.234.245.64647: UDP, length 1317
18:48:21.328699 IP 90.156.234.245.64647 > XXX.XXX.XXX.XXX.56000: UDP, length 1317
18:48:21.328792 IP XXX.XXX.XXX.XXX.56000 > 90.156.234.245.64647: UDP, length 1317
18:48:21.379606 IP 90.156.234.245.64647 > XXX.XXX.XXX.XXX.56000: UDP, length 1317
18:48:21.379643 IP XXX.XXX.XXX.XXX.56000 > 90.156.234.245.64647: UDP, length 1317
18:48:21.430883 IP 90.156.234.245.64647 > XXX.XXX.XXX.XXX.56000: UDP, length 1317
18:48:21.430937 IP XXX.XXX.XXX.XXX.56000 > 90.156.234.245.64647: UDP, length 1317
18:48:21.481462 IP 90.156.234.245.64647 > XXX.XXX.XXX.XXX.56000: UDP, length 1317
18:48:21.481521 IP XXX.XXX.XXX.XXX.56000 > 90.156.234.245.64647: UDP, length 1317

А на loopback трафик появляется только через 35 секунд:

18:48:56.274655 IP 127.0.0.1.11418 > 127.0.0.1.51820: UDP, length 148
18:48:56.274682 IP 127.0.0.1.11418 > 127.0.0.1.51820: UDP, length 148
18:48:56.274843 IP 127.0.0.1.51820 > 127.0.0.1.11418: UDP, length 92
18:48:56.275712 IP 127.0.0.1.11418 > 127.0.0.1.51820: UDP, length 148
18:48:56.275739 IP 127.0.0.1.11418 > 127.0.0.1.51820: UDP, length 148
18:48:56.275778 IP 127.0.0.1.11418 > 127.0.0.1.51820: UDP, length 148
18:48:56.275810 IP 127.0.0.1.11418 > 127.0.0.1.51820: UDP, length 148
18:48:56.275885 IP 127.0.0.1.11418 > 127.0.0.1.51820: UDP, length 148

В режиме SRTP измерений я не делаю (по крайней мере пока) и там трафик на loopback должен появляться одновременно с трафиком на интерфейсе, который смотрит в интернет.

**Comment by SanchezZz-z** [comment]
В самом деле, в режиме SRTP заработало. Ура)


> А как долго вы ждали результатов tcpdump на loopback?

Недолго. Секунд 10-20. Долго не ждал, потому что видел, что с другого клиента трафик идет почти сразу.


Еще, возможно, меня вводили в заблуждение нулевые метрики, кроме пинга (на скриншоте). Хотя при этом все работает.

<img width="1106" height="1280" alt="Image" src="https://github.com/user-attachments/assets/2770c568-059b-409b-8997-861f21a29472" />

Кстати, насчет логов на клиенте. Тут почему-то без изменений.

> Логи на клиенте не показывают ничего дальше строчки:
> 
> [2026-05-24 20:45:12.716] [Tunnel] vk: success via VK Calls captcha-free path

Это не может быть связано с версией iOS? Просто я на старой сижу (18.7.8).

За Ваш клиент еще раз спасибо:)

**Comment by SanchezZz-z** [comment]
Насчет логов и нулевых метрик есть гипотеза. Настроил еще на двух других устройствах через testflight и там все нормально: и метрики меняются, и логи пишутся. К себе на айфон я просто подписанный .ipa файл устанавливал.

**Comment by anton48** [comment]
> Насчет логов и нулевых метрик есть гипотеза. Настроил еще на двух других устройствах через testflight и там все нормально: и метрики меняются, и логи пишутся. К себе на айфон я просто подписанный .ipa файл устанавливал.

да, это явно пермишенны, которые на IPA файле как-то не так выдаются/устанавливаются.

**Comment by anton48** [comment]
> В самом деле, в режиме SRTP заработало. Ура)

если на SRTP заработало, то и на DTLS должно работать, в смысле wireguard они одинаковые. видимо, надо было просто подождать.
