### ISSUE TITLE
Добавить использование dns сервера

### ISSUE THREAD

**Issue by WaveGu1de** [anton48/vk-turn-proxy-ios#9]
Спасибо за версию для ios, все отлично работает. Даже удалось подружить с amneziawg на сервере и при этом остался прямой путь, без вк звонков, на случай, если белых списков нет.
Но вопрос в том, можно ли как-то сделать поддержку использования dns самого сервера, к которому подключаюсь? На amneziawg это решается указанием 192.168.1.1 в поле dns. А тут, если я делаю так же, то это не помогает. У меня на сервере в hosts прописаны специальные адреса для нейросетей и, когда я подключаюсь к нему  через Amneziawg, то у меня нейросети работают, а если через это приложение, то нет. Можно это как-то решить?

**Comment by anton48** [comment]
> Но вопрос в том, можно ли как-то сделать поддержку использования dns самого сервера, к которому подключаюсь? На amneziawg это решается указанием 192.168.1.1 в поле dns. А тут, если я делаю так же, то это не помогает.

у меня работает (192.168.102.4 - адрес клиента, 192.168.102.1 - адрес сервера, конкретно его wireguard интерфейса):

<img width="750" height="529" alt="Image" src="https://github.com/user-attachments/assets/90ba8ce5-3054-48c3-9805-149b7383d913" />


DNS сервер должен слушать этот адрес и ему должно быть разрешено отвечать на запросы с IP сети клиентов. 

MacBook-Air-M4:11.05.2026 a48$ grep "192.168.102" vpn.wifi.5.log
[2026-05-11 13:35:06.265] [Tunnel] tunnelAddress=192.168.102.4/24 dns=192.168.102.1 mtu=1280

tcpdump: verbose output suppressed, use -v[v]... for full protocol decode
listening on wg0, link-type NULL (BSD loopback), snapshot length 262144 bytes
13:35:08.412893 IP 192.168.102.4.58594 > 192.168.102.1.53: 32017+ HTTPS? gsp-ssl.ls.apple.com. (38)
13:35:08.413605 IP 192.168.102.4.58427 > 192.168.102.1.53: 51640+ A? gsp-ssl.ls.apple.com. (38)
13:35:08.504057 IP 192.168.102.1.53 > 192.168.102.4.58427: 51640 4/0/0 CNAME gspx-ssl.ls.apple.com., CNAME get-bx.g.aaplimg.com., A 17.253.57.219, A 17.253.57.218 (124)
13:35:08.504073 IP 192.168.102.1.53 > 192.168.102.4.58594: 32017 2/1/0 CNAME gspx-ssl.ls.apple.com., CNAME get-bx.g.aaplimg.com. (146)

**Comment by WaveGu1de** [comment]
У меня так не получится, потому что amneziawg у меня использует подсеть 10.0.0.х. Если я заменю на 192.168.1.х, то, наверное, будет конфликт с физической локальной сетью. А если поставить на айфоне в качестве днс 10.0.0.1, то мне никак не заставить мой "сервер" перенаправлять днс запросы на 192.168.1.1, он упорно их отбрасывает, потому что видит, что они не его. 
Все дело в том, что у меня в качестве сервера выступает старый андроид смартфон, лежащий дома в сети wi-fi. Да, понимаю, это тот еще изврат, но пока жду когда придет мини пк. Я там уже очень много смог настроить, и tg-ws-proxy, и vk-turn-proxy, и amneziawg, и всякие удаленные доступы, и автоматизацию, чтобы сам мог контролировать свою работу и принимать меры в случае чего. Но вот с днс именно на айфоне победить не смог. 
Если на андроиде подключаться через отдельное приложение vk-turn-proxy, а потом использовать амнезию, в которой выставлен днс роутера, то он использует хостс этого роутера, поэтому я подумал, раз тут объединенное приложение с wireguard, то может тут тоже есть возможность добавить такой же функционал

**Comment by anton48** [comment]
да, это настройка именно wireguard, говорит какой DNS будет использоваться при работе через его туннель. 

можно поставить и 192.168.1.1, если этот адрес есть на сервере и там запущен DNS сервис, который на нем слушает и отвечает.

[2026-05-12 17:29:00.879] [Tunnel] tunnelAddress=192.168.102.5/24 dns=192.168.1.1 mtu=1280

tcpdump: verbose output suppressed, use -v[v]... for full protocol decode
listening on wg0, link-type NULL (BSD loopback), snapshot length 262144 bytes
17:29:03.105867 IP 192.168.102.5.51576 > 192.168.1.1.53: 31746+ HTTPS? gsp-ssl.ls.apple.com. (38)
17:29:03.105973 IP 192.168.102.5.57671 > 192.168.1.1.53: 40695+ A? gsp-ssl.ls.apple.com. (38)
17:29:03.263848 IP 192.168.1.1.53 > 192.168.102.5.57671: 40695 4/0/0 CNAME gspx-ssl.ls.apple.com., CNAME get-bx.g.aaplimg.com., A 17.253.57.213, A 17.253.57.218 (124)
17:29:03.274849 IP 192.168.1.1.53 > 192.168.102.5.51576: 31746 2/1/0 CNAME gspx-ssl.ls.apple.com., CNAME get-bx.g.aaplimg.com. (146)

<img width="719" height="1280" alt="Image" src="https://github.com/user-attachments/assets/95950818-7b64-47c9-befd-b654cbc89b2d" />
