### ISSUE TITLE
Что то не так делаю...

### ISSUE THREAD

**Issue by slaiter07** [anton48/vk-turn-proxy-ios#19]
Запустил сервер с SRTP, на клиенте статус connected, на сервере показываются хэндшейки
<img width="792" height="418" alt="Image" src="https://github.com/user-attachments/assets/73c0466a-8430-4867-9a68-e4c5f141fade" />

<img width="1179" height="2556" alt="Image" src="https://github.com/user-attachments/assets/de4e445b-c135-4c87-9fe1-4ebc5277c568" />
при этом интернет не работает совсем, если что то пинговать выходит no route to host

<img width="1179" height="2556" alt="Image" src="https://github.com/user-attachments/assets/76a2c7f2-0993-4356-8550-93162c210a73" />
Сам клиент настроен так:

<img width="1179" height="2556" alt="Image" src="https://github.com/user-attachments/assets/0be4d0cb-78c9-4789-a1dd-909e62f1f6cb" />
всю голову уже сломал что я упустил(

**Comment by anton48** [comment]
запустите на сервере tcpdump на loopback чтобы посмотреть идет ли и какой трафик до wireguard сервера и обратно (порт 51820 - это порт на котором слушает wireguard):

tcpdump -n -i lo0 port 51820
tcpdump: verbose output suppressed, use -v[v]... for full protocol decode
listening on lo0, link-type NULL (BSD loopback), snapshot length 262144 bytes
14:53:22.810085 IP 127.0.0.1.17833 > 127.0.0.1.51820: UDP, length 148
14:53:22.810373 IP 127.0.0.1.51820 > 127.0.0.1.17833: UDP, length 92
14:53:22.821645 IP 127.0.0.1.33264 > 127.0.0.1.51820: UDP, length 32
14:53:22.821688 IP 127.0.0.1.51820 > 127.0.0.1.33264: UDP, length 32
14:53:22.844179 IP 127.0.0.1.17833 > 127.0.0.1.51820: UDP, length 112
14:53:22.847607 IP 127.0.0.1.33264 > 127.0.0.1.51820: UDP, length 112
14:53:22.897882 IP 127.0.0.1.51820 > 127.0.0.1.33264: UDP, length 208
14:53:22.901913 IP 127.0.0.1.51820 > 127.0.0.1.33264: UDP, length 192
14:53:22.912170 IP 127.0.0.1.17833 > 127.0.0.1.51820: UDP, length 112
14:53:22.916987 IP 127.0.0.1.33264 > 127.0.0.1.51820: UDP, length 96
14:53:22.962681 IP 127.0.0.1.51820 > 127.0.0.1.33264: UDP, length 96
14:53:22.966265 IP 127.0.0.1.51820 > 127.0.0.1.33264: UDP, length 160
14:53:22.974656 IP 127.0.0.1.33264 > 127.0.0.1.51820: UDP, length 416
14:53:22.974894 IP 127.0.0.1.22537 > 127.0.0.1.51820: UDP, length 96
14:53:22.975764 IP 127.0.0.1.17833 > 127.0.0.1.51820: UDP, length 1312

так же посмотрите в логах wireguard, что он пишет.

**Comment by slaiter07** [comment]
в tcpdump так:
listening on lo, link-type EN10MB (Ethernet), snapshot length 262144 bytes
14:34:25.838030 IP 127.0.0.1.2489 > 127.0.0.1.51820: UDP, length 148
14:34:25.839752 IP 127.0.0.1.51820 > 127.0.0.1.2489: UDP, length 92
14:34:26.125866 IP 127.0.0.1.15481 > 127.0.0.1.51820: UDP, length 32
14:34:51.135846 IP 127.0.0.1.44838 > 127.0.0.1.51820: UDP, length 32
в логах wg-easy ничего интересного не нашёл, при этом в веб интерфейсе подключение становится активно

<img width="550" height="74" alt="Image" src="https://github.com/user-attachments/assets/2c71c612-49e6-4873-9505-2c76fd0c05c5" />
но уже дальше не идёт

**Comment by anton48** [comment]
такой вывод tcpdump означает, что wireguard часть ios приложения успешно общается с вашим wireguard сервером. 

строчек, правда, мало, чтобы увидеть - пошли ли уже реальные пакеты данных типа этого или нет:

14:53:22.975764 IP 127.0.0.1.17833 > 127.0.0.1.51820: UDP, length 1312

дальше уже вопрос настроек. например, не настроен NAT для адреса этого пира. или не разрешено в firewall. или на стороне клиента прописан адрес, который не совпадает с разрешенным адресом на стороне сервера для этого пира. вариантов, где может поломаться много.

**Comment by slaiter07** [comment]
Благодарю, вроде разобрался, все теперь работает корректно. Спасибо за отличный клиент под ios!!!
