### ISSUE TITLE
Пуш уведомления

### ISSUE THREAD

**Issue by antoniy94** [anton48/vk-turn-proxy-ios#47]
Добрый день. У мне при включении перестают приходить уведомления, при этом не важно включены бы или нет. С другими впн такой проблем не было, иногда даже уведомления приходят и при бс при работе с другими приложениями. Это только у меня такая проблема или особенность работы и можно ли это как то решить? Заранее спасибо за ответ.

**Comment by anton48** [comment]
в этом приложении специально включены настройки, которые позволяют приходить уведомлениям через его туннель, в том числе в случае БС. если у вас не работает, то, к сожалению, каких-то средств диагностики почему это не так на iOS нет.

**Comment by antoniy94** [comment]
А у других пользователей это точно работает? Я уже на трёх айфонах с разных операторов тестировал, при включении прокси, все уведомления перестают приходить, что при бс, что по вайфай

**Comment by anton48** [comment]
точно работает (только что проверил, правда, без БС).

а вы устанавливали приложение через TestFlight или IPA?

**Comment by antoniy94** [comment]
Устанавливал через testflight. Есть смысл пробовать через ipa?

**Comment by anton48** [comment]
> Устанавливал через testflight. Есть смысл пробовать через ipa?

нет, наоборот через IPA могут быть всякие дополнительные сложности, в том числе с корректной регистрацией VPN профайла.

а на VPS если посмотреть, есть ли там общение с серверами APN?

это выглядит примерно так:

```
tcpdump -n -i wg0 port 5223
tcpdump: verbose output suppressed, use -v[v]... for full protocol decode
listening on wg0, link-type NULL (BSD loopback), snapshot length 262144 bytes
13:24:30.180074 IP 17.57.146.55.5223 > 192.168.102.4.56533: Flags [P.], seq 821:1464, ack 73, win 862, options [nop,nop,TS val 3029945815 ecr 928669133], length 643
13:24:30.180236 IP 17.57.146.55.5223 > 192.168.102.4.56533: Flags [P.], seq 1464:1514, ack 73, win 862, options [nop,nop,TS val 3029945815 ecr 928669133], length 50
13:24:30.341353 IP 192.168.102.4.56533 > 17.57.146.55.5223: Flags [.], ack 1514, win 2038, options [nop,nop,TS val 928723124 ecr 3029945815], length 0
13:24:30.457521 IP 192.168.102.4.56533 > 17.57.146.55.5223: Flags [P.], seq 73:105, ack 1514, win 2048, options [nop,nop,TS val 928723238 ecr 3029945815], length 32
13:24:30.458903 IP 192.168.102.4.56533 > 17.57.146.55.5223: Flags [P.], seq 105:145, ack 1514, win 2048, options [nop,nop,TS val 928723239 ecr 3029945815], length 40
13:24:30.502930 IP 17.57.146.55.5223 > 192.168.102.4.56533: Flags [.], ack 145, win 862, options [nop,nop,TS val 3029946138 ecr 928723238], length 0
13:24:30.503104 IP 17.57.146.55.5223 > 192.168.102.4.56533: Flags [P.], seq 1514:1538, ack 145, win 862, options [nop,nop,TS val 3029946138 ecr 928723238], length 24
13:24:30.624970 IP 192.168.102.4.56533 > 17.57.146.55.5223: Flags [.], ack 1538, win 2048, options [nop,nop,TS val 928723407 ecr 3029946138], length 0
```

адреса Apple вида 17.0.0.0/8 (или вот тут точные [диапазоны](https://support.apple.com/en-us/102266)), порт 5223 (или может быть 443). 

выше это что происходит на интерфейсе WireGuard на VPS, когда на телефон с включенным VPN приходит уведомление (17.57.146.55 - сервер Apple, 192.168.102.4 - адрес клиента vk-turn-proxy-ios).

**Comment by antoniy94** [comment]
А это может зависеть от режима server mode? Я использую SRTP-WRAP-A, так как через андроид приложение устанавливал.

**Comment by anton48** [comment]
> А это может зависеть от режима server mode? Я использую SRTP-WRAP-A, так как через андроид приложение устанавливал.

не должно. сетевой интерфейс там другой и адреса другие, но суть та же:

На внутреннем интерфейсе wdtt:

```
tcpdump -n -i wdtt0 port 5223
tcpdump: verbose output suppressed, use -v[v]... for full protocol decode
listening on wdtt0, link-type RAW (Raw IP), snapshot length 262144 bytes
12:00:10.568766 IP 17.57.146.135.5223 > 10.66.66.2.65015: Flags [P.], seq 2197775002:2197775592, ack 3564007338, win 249, options [nop,nop,TS val 1288577769 ecr 447954236], length 590
12:00:10.568782 IP 17.57.146.135.5223 > 10.66.66.2.65015: Flags [P.], seq 590:616, ack 1, win 249, options [nop,nop,TS val 1288577769 ecr 447954236], length 26
12:00:10.568784 IP 17.57.146.135.5223 > 10.66.66.2.65015: Flags [P.], seq 616:640, ack 1, win 249, options [nop,nop,TS val 1288577769 ecr 447954236], length 24
12:00:10.698149 IP 10.66.66.2.65015 > 17.57.146.135.5223: Flags [.], ack 640, win 2039, options [nop,nop,TS val 447984890 ecr 1288577769], length 0
12:00:10.881371 IP 10.66.66.2.65015 > 17.57.146.135.5223: Flags [P.], seq 1:33, ack 640, win 2048, options [nop,nop,TS val 447985073 ecr 1288577769], length 32
12:00:10.882218 IP 10.66.66.2.65015 > 17.57.146.135.5223: Flags [P.], seq 33:73, ack 640, win 2048, options [nop,nop,TS val 447985075 ecr 1288577769], length 40
12:00:10.894336 IP 17.57.146.135.5223 > 10.66.66.2.65015: Flags [.], ack 73, win 249, options [nop,nop,TS val 1288578095 ecr 447985073], length 0
12:00:10.894463 IP 17.57.146.135.5223 > 10.66.66.2.65015: Flags [P.], seq 640:664, ack 73, win 249, options [nop,nop,TS val 1288578095 ecr 447985073], length 24
12:00:11.027275 IP 10.66.66.2.65015 > 17.57.146.135.5223: Flags [.], ack 664, win 2048, options [nop,nop,TS val 447985218 ecr 1288578095], length 0
```

На внешнем интерфейсе, который смотрит в интернет:

```
tcpdump -n -i eth0 port 5223
tcpdump: verbose output suppressed, use -v[v]... for full protocol decode
listening on eth0, link-type EN10MB (Ethernet), snapshot length 262144 bytes
12:02:05.486192 IP 17.57.146.135.5223 > 192.168.0.3.65015: Flags [P.], seq 2197775873:2197776452, ack 3564007482, win 249, options [nop,nop,TS val 1288692686 ecr 448003812], length 579
12:02:05.486193 IP 17.57.146.135.5223 > 192.168.0.3.65015: Flags [P.], seq 579:605, ack 1, win 249, options [nop,nop,TS val 1288692686 ecr 448003812], length 26
12:02:05.486193 IP 17.57.146.135.5223 > 192.168.0.3.65015: Flags [P.], seq 605:629, ack 1, win 249, options [nop,nop,TS val 1288692686 ecr 448003812], length 24
12:02:05.624100 IP 192.168.0.3.65015 > 17.57.146.135.5223: Flags [.], ack 629, win 2039, options [nop,nop,TS val 448099815 ecr 1288692686], length 0
12:02:05.738344 IP 192.168.0.3.65015 > 17.57.146.135.5223: Flags [P.], seq 1:33, ack 629, win 2048, options [nop,nop,TS val 448099929 ecr 1288692686], length 32
12:02:05.738360 IP 192.168.0.3.65015 > 17.57.146.135.5223: Flags [P.], seq 33:73, ack 629, win 2048, options [nop,nop,TS val 448099931 ecr 1288692686], length 40
12:02:05.750982 IP 17.57.146.135.5223 > 192.168.0.3.65015: Flags [.], ack 73, win 249, options [nop,nop,TS val 1288692951 ecr 448099929], length 0
12:02:05.750982 IP 17.57.146.135.5223 > 192.168.0.3.65015: Flags [P.], seq 629:653, ack 73, win 249, options [nop,nop,TS val 1288692951 ecr 448099929], length 24
12:02:05.879261 IP 192.168.0.3.65015 > 17.57.146.135.5223: Flags [.], ack 653, win 2048, options [nop,nop,TS val 448100072 ecr 1288692951], length 0
```

**Comment by a1keen** [comment]
Столкнулся с такой же проблемой, выключаешь впн и переходишь на wi-fi и сразу сыпятся уведомления пачкой за все время пока было активно подключение.

**Comment by anton48** [comment]
> Столкнулся с такой же проблемой, выключаешь впн и переходишь на wi-fi и сразу сыпятся уведомления пачкой за все время пока было активно подключение.

автор этой issue не откликнулся на вопрос, что показывает tcpdump на сервере. а как у вас?

**Comment by antoniy94** [comment]
> > Столкнулся с такой же проблемой, выключаешь впн и переходишь на wi-fi и сразу сыпятся уведомления пачкой за все время пока было активно подключение.
> 
> автор этой issue не откликнулся на вопрос, что показывает tcpdump на сервере. а как у вас?

У меня уведомления теперь работают всегда, кроме как в режиме бс. Раньше не работали и при Wi-Fi и при обычном LTE. Сейчас уехал на месяц из страны, поэтому пока проверить не получится

**Comment by anton48** [comment]
> У меня уведомления теперь работают всегда, кроме как в режиме бс. 

то есть: включены белые списки, само приложение vk-turn-proxy-ios поверх них работает и доступ в интернет на устройстве есть, но пуши не приходят?

>Раньше не работали и при Wi-Fi и при обычном LTE.

а в какой момент это поведение изменилось?

**Comment by antoniy94** [comment]
> > У меня уведомления теперь работают всегда, кроме как в режиме бс.
> 
> то есть: включены белые списки, само приложение vk-turn-proxy-ios поверх них работает и доступ в интернет на устройстве есть, но пуши не приходят?
> 
> > Раньше не работали и при Wi-Fi и при обычном LTE.
> 
> а в какой момент это поведение изменилось?

Поведение изменилось наверное на след день или через день после нашего с вами диалога. Притом обновления никакого не было, была версия 165. Но уведомления просто стали приходить. Но как только включается режим бв в городе, то уведомления не приходят и потом сразу все приходят либо при подключении к wi fi либо после отключения бс. При этом VPN не выключаю.

**Comment by a1keen** [comment]
> > Столкнулся с такой же проблемой, выключаешь впн и переходишь на wi-fi и сразу сыпятся уведомления пачкой за все время пока было активно подключение.
> 
> автор этой issue не откликнулся на вопрос, что показывает tcpdump на сервере. а как у вас?

Вроде разобрался, проблема на стороне хостера TCP/5223 заблокирован.

**Comment by anton48** [comment]
> Вроде разобрался, проблема на стороне хостера TCP/5223 заблокирован.

спасибо за репорт, хоть какая-то определенность по этой проблеме :)

правда, Apple пишет "TCP port 443 is used during device activation, and afterwards for fallback if devices can't reach APNs on port 5223". возможно, этот fallback не всегда срабатывает.

**Comment by a1keen** [comment]
> > Вроде разобрался, проблема на стороне хостера TCP/5223 заблокирован.
> 
> спасибо за репорт, хоть какая-то определенность по этой проблеме :)
> 
> правда, Apple пишет "TCP port 443 is used during device activation, and afterwards for fallback if devices can't reach APNs on port 5223". возможно, этот fallback не всегда срабатывает.

Да, похоже, fallback на TCP/443 в моём случае действительно не сработал либо не успел сработать за время теста.

В pcap видно, что iPhone одновременно перебирает несколько адресов 17.57.146.x исключительно на порту 5223. SYN проходит через туннель, корректно NAT'ится на VPS и выходит через внешний интерфейс, но SYN-ACK не возвращается.

При этом с самого VPS:

courier.push.apple.com:443 — доступен
courier.push.apple.com:5223 — timeout

То есть TCP/443 на сервере не заблокирован, но iOS продолжала пытаться подключиться к APNs по 5223 и на 443 не переключилась. После отключения VPN уведомления сразу начали приходить через обычное подключение.

Написал им с просьбой снять ограничение. После открытия порта повторю тест и отпишусь, восстановились ли push-уведомления.

**Comment by antoniy94** [comment]
Мне тогда тоже лучше проверить на сервере доступность этого порта? Есть еще какие то порты, которые лучше сразу проверить?

**Comment by anton48** [comment]
> Мне тогда тоже лучше проверить на сервере доступность этого порта? 

от проверки хуже не будет в любом случае :) 

но ваше последниее описание проблемы "уведомления просто стали приходить. Но как только включается режим бв в городе, то уведомления не приходят и потом сразу все приходят либо при подключении к wi fi либо после отключения бс" - больше походит на то, что у вас iOS по какой-то причине не отправляет пуши в тоннель, несмотря на то, что настройка включена. то есть, без БС они ходят мимо тоннеля и доходят до телефона, а когда включают БС, то их режут и они перестают доходить. потому что если бы они ходили в тоннеле, то включение БС не оказывало бы влияния. 

>Есть еще какие то порты, которые лучше сразу проверить?

Apple описывает так:

- TCP port 5223 to communicate with APNs
- TCP port 443 or 2197 to send notifications to APNs

**Comment by antoniy94** [comment]
> > Мне тогда тоже лучше проверить на сервере доступность этого порта?
> 
> от проверки хуже не будет в любом случае :)
> 
> но ваше последниее описание проблемы "уведомления просто стали приходить. Но как только включается режим бв в городе, то уведомления не приходят и потом сразу все приходят либо при подключении к wi fi либо после отключения бс" - больше походит на то, что у вас iOS по какой-то причине не отправляет пуши в тоннель, несмотря на то, что настройка включена. то есть, без БС они ходят мимо тоннеля и доходят до телефона, а когда включают БС, то их режут и они перестают доходить. потому что если бы они ходили в тоннеле, то включение БС не оказывало бы влияния.
> 
> > Есть еще какие то порты, которые лучше сразу проверить?
> 
> Apple описывает так:
> 
> * TCP port 5223 to communicate with APNs
> * TCP port 443 or 2197 to send notifications to APNs

Понял. Я тогда вернусь в рф через месяц и протестирую повторно.

**Comment by a1keen** [comment]
По поводу проблемы мой кейс можно считать закрытым, провайдер разблокировал со своей стороны 5223 и уведомления стали приходить как следует.

**Comment by anton48** [comment]
> По поводу проблемы мой кейс можно считать закрытым, провайдер разблокировал со своей стороны 5223 и уведомления стали приходить как следует.

отлично. и под БС?

**Comment by a1keen** [comment]
> > По поводу проблемы мой кейс можно считать закрытым, провайдер разблокировал со своей стороны 5223 и уведомления стали приходить как следует.
> 
> отлично. и под БС?

Пока бс нет (что хорошо), как будет - проверю. Думаю что должно также работать.

**Comment by a1keen** [comment]
> > По поводу проблемы мой кейс можно считать закрытым, провайдер разблокировал со своей стороны 5223 и уведомления стали приходить как следует.
> 
> отлично. и под БС?

Проверил: под БС все уведомления приходят отлично!

**Comment by antoniy94** [comment]
Можете пожалуйста посоветовать хостинг, на котором будут открыт порт 5223, мой хостинг его блокирует и даже по запросу из соображений безопастности не хочет разблокировать даже по запросу

**Comment by anton48** [comment]
из зарубежных я лично пользуюсь этими: https://www.hetzner.com https://www.vultr.com https://www.ssdnodes.com https://www.clouvider.com

**Comment by antoniy94** [comment]
Там уже порты открыты или через поддержку надо открывать?
