### ISSUE TITLE
amneziaWG2.0 сервер

### ISSUE THREAD

**Issue by GMODENGINE** [anton48/vk-turn-proxy-ios#23]
У меня стоит стоит сервер в нидерландах с параметрами 
S1 = 
S2 = 
S3 = 
S4 = 
H1 = 
H2 = 
H3 = 
H4 = 

Соотвественно в файле клиента эти параметры указаны. В приложение для ios я ввожу только ключи клиента. Сервер и клиент приложения последние. По протоколу legacy подключается, но при этом нет интернета, протокол SRTP вообще не подключается.

**Comment by anton48** [comment]
> Соотвественно в файле клиента эти параметры указаны. 

в файле какого клиента? в vk-turn-proxy-ios нет места для указания этих параметров, значит вы говорите про какой-то другой клиент?

>В приложение для ios я ввожу только ключи клиента.

в разделе wireguard там должны быть введены: приватный ключ клиента, публичный ключ сервера, опционально preshared key, адрес клиента на интерфейсе wireguard, dns и разрешенные ip адреса (0.0.0.0/0).

**Comment by GMODENGINE** [comment]
Имел ввиду что при создании файла для клиента на моем сервере, в файле есть эти данные. С протоколом SRTP разобрался, поставил по новой и заработал, подключение проходит, но при этом доступа в интернет нет.

**Comment by GMODENGINE** [comment]
Для теста могу для вас создать файл клиента на сервере и предоставить.

**Comment by anton48** [comment]
> Имел ввиду что при создании файла для клиента на моем сервере, в файле есть эти данные. С протоколом SRTP разобрался, поставил по новой и заработал, подключение проходит, но при этом доступа в интернет нет.

запустите на сервере tcpdump -n -i lo port 51820 (или -i lo0 или другое имя вашего loopback). 51820 - это порт на котором слушает wireguard на локальном интерфейсе. если после установления соединения в приложении для ios на сервере пакеты ходят в обе стороны, примерно так:

tcpdump -n -i lo0 port 51820
tcpdump: verbose output suppressed, use -v[v]... for full protocol decode
listening on lo0, link-type NULL (BSD loopback), snapshot length 262144 bytes
22:01:10.074254 IP 127.0.0.1.32594 > 127.0.0.1.51820: UDP, length 96
22:01:10.125587 IP 127.0.0.1.51820 > 127.0.0.1.32594: UDP, length 96
22:01:10.133675 IP 127.0.0.1.59680 > 127.0.0.1.51820: UDP, length 400
22:01:10.133769 IP 127.0.0.1.42449 > 127.0.0.1.51820: UDP, length 1312
22:01:10.184711 IP 127.0.0.1.51820 > 127.0.0.1.42449: UDP, length 96
22:01:10.184829 IP 127.0.0.1.51820 > 127.0.0.1.42449: UDP, length 96
22:01:10.185689 IP 127.0.0.1.51820 > 127.0.0.1.42449: UDP, length 1312
22:01:10.185823 IP 127.0.0.1.51820 > 127.0.0.1.42449: UDP, length 1312
22:01:10.185824 IP 127.0.0.1.51820 > 127.0.0.1.42449: UDP, length 1312
22:01:10.185824 IP 127.0.0.1.51820 > 127.0.0.1.42449: UDP, length 448
22:01:10.193294 IP 127.0.0.1.58444 > 127.0.0.1.51820: UDP, length 1312

то значит все свои функции приложение для ios выполнило и дальше уже вопрос к настройкам вашего сервера. NAT, например, firewall, несовпадение адресов peer, роутинг итд.

**Comment by anton48** [comment]
> Для теста могу для вас создать файл клиента на сервере и предоставить.

я предпочту не трогать чужие сервера :)

**Comment by GMODENGINE** [comment]
for full protocol decode
listening on lo, link-type EN10MB (Ethernet), snapshot length 262144 bytes
19:18:23.901243 IP 127.0.0.1.46950 > 127.0.0.1.56779: UDP, length 148
19:18:29.068672 IP 127.0.0.1.33154 > 127.0.0.1.56779: UDP, length 148
19:18:34.127165 IP 127.0.0.1.38286 > 127.0.0.1.56779: UDP, length 148
19:18:39.361652 IP 127.0.0.1.53277 > 127.0.0.1.56779: UDP, length 148
19:18:44.464678 IP 127.0.0.1.60346 > 127.0.0.1.56779: UDP, length 148
19:18:49.756475 IP 127.0.0.1.40312 > 127.0.0.1.56779: UDP, length 148
19:18:55.018496 IP 127.0.0.1.54261 > 127.0.0.1.56779: UDP, length 148
19:19:00.297171 IP 127.0.0.1.37629 > 127.0.0.1.56779: UDP, length 148
19:19:50.491651 IP 127.0.0.1.40366 > 127.0.0.1.56779: UDP, length 148
19:19:55.579548 IP 127.0.0.1.46260 > 127.0.0.1.56779: UDP, length 148
19:20:00.850412 IP 127.0.0.1.39049 > 127.0.0.1.56779: UDP, length 148

**Comment by anton48** [comment]
такой вывод означает, что ваш wireguard сервер не отвечает на пакеты, которые ему присылает серверная часть vk-turn-proxy. например, wireguard сервер не слушает на этом порту. или он не знает такого peer (ошибка в ключах на стороне клиента, ошибка в настроке [Peer] на стороне сервера).

**Comment by GMODENGINE** [comment]
Ввел в адрес в окне wireguard, Адрес клиента вместо 127.0.0.1:9000 так 10.77.0.2/32:9000 и сразу трафик поехал через стандартный wireguard без Обфускации в обход белых списков. Благодарю!

**Comment by anton48** [comment]
я же это писал в первом ответе вам :) "в разделе wireguard там должны быть введены: приватный ключ клиента, публичный ключ сервера, опционально preshared key, **адрес клиента на интерфейсе wireguard**, dns и разрешенные ip адреса (0.0.0.0/0)"

в этом приложении нет "костыля" 127.0.0.1:9000, то есть сокета, через который локально на телефоне гоняют пакеты до wireguard. 

ну, и если вы действительно ввели "10.77.0.2/32:9000", то это неправильно, порта там быть не должно, только адрес и маска "10.77.0.2/32".

**Comment by GMODENGINE** [comment]
Самое главное работает) Вдруг кому поможет.Спасибо за программу это топ!
